{
  "envelopeVersion": "1.0.0",
  "artifactType": "system-builder/release-artifact",
  "artifactId": "urn:uuid:71f2f9c4-8a7b-4c6d-9e0a-2b3c4d5e6f7a",
  "artifactVersion": "5.0.0",
  "schema": {
    "id": "https://system-builder.example/schemas/release-artifact.json",
    "version": "2.0.0"
  },
  "provenance": {
    "createdAt": "2026-08-14T11:00:00Z",
    "producer": {
      "id": "system-builder/compiler",
      "version": "1.0.0"
    },
    "inputs": []
  },
  "requiredExtensions": ["urn:third-party:proprietary-policy"],
  "payload": {
    "component": "gestao-tecnica",
    "format": "docker"
  }
}