{
  "envelopeVersion": "1.1.0",
  "artifactType": "urn:example:business-recipe",
  "artifactId": "urn:uuid:b1e2f3a4-5b6c-4d7e-8f9a-1b2c3d4e5f6a",
  "artifactVersion": "2.0.0",
  "schema": {
    "id": "urn:example:schemas:business-recipe",
    "version": "1.3.0"
  },
  "provenance": {
    "createdAt": "2026-08-14T10:05:00.123Z",
    "producer": {
      "id": "urn:example:recipe-author",
      "version": "3.1.4",
      "operator": "alice"
    },
    "inputs": [
      {
        "artifactType": "system-builder/process-mirror",
        "artifactId": "urn:uuid:5a0e3c9f-1a2b-4c3d-9e8f-0a1b2c3d4e5f",
        "artifactVersion": "1.2.1",
        "digest": {
          "algorithm": "sha256",
          "value": "e3b0c44298fc1c149afbf4c8996fb924"
        }
      }
    ],
    "operation": "approve"
  },
  "requiredExtensions": ["urn:system-builder:tracing"],
  "extensions": {
    "urn:example:vendor:quality": { "score": 0.9, "tags": ["reviewed"] },
    "com.example.audit": ["2026-08-14T10:05:00Z"]
  },
  "payload": {
    "domains": ["gerenciamento"],
    "processes": []
  }
}