{
  "envelopeVersion": "1.0.0",
  "artifactType": "system-builder/process-mirror",
  "artifactId": "urn:uuid:5a0e3c9f-1a2b-4c3d-9e8f-0a1b2c3d4e5f",
  "artifactVersion": "1.2.1",
  "schema": {
    "id": "https://system-builder.example/schemas/process-mirror.json",
    "version": "0.4.0"
  },
  "provenance": {
    "createdAt": "2026-08-14T10:00:00Z",
    "producer": {
      "id": "system-builder/mirror",
      "version": "0.9.2"
    },
    "inputs": []
  },
  "payload": {
    "nodes": [],
    "edges": []
  }
}